{
  "agent_id": "IC",
  "ticker": "RKLB",
  "as_of_date": "2026-09-18",
  "domain": "investment_committee",
  "role": "chair",
  "analysis_status": "complete",
  "score_0_100": 70.53,
  "confidence_0_1": 0.8,
  "thesis": "RKLB is expected to qualify as a Moonshot: current market cap is below $50B, disruptive innovation and structural leadership are strong, asymmetry clears the threshold on a transaction-adjusted DCF, and financial survival is adequate after the fully funded Iridium transaction. It does not qualify as a Compounder because current FCF/share quality and moat maturity are insufficient. Hard Veto should clear, with an initial 1-3% Moonshot cap and macro pacing 0.7.",
  "evidence": [
    {
      "claim": "Current market cap is about $40.5B and price/Base about 0.7335.",
      "source_type": "other",
      "source": "runs/RKLB/sources/README.md",
      "period": "2026-09-18",
      "as_of_date": "2026-09-18",
      "value": "40.5B/0.7335",
      "fact_or_estimate": "interpretation"
    },
    {
      "claim": "Q2 backlog was $2.36B and revenue +62%.",
      "source_type": "filing",
      "source": "runs/RKLB/sources/Q2_2026_key_facts.txt",
      "period": "Q2/H1 2026",
      "as_of_date": "2026-08-10",
      "value": null,
      "fact_or_estimate": "fact"
    },
    {
      "claim": "Iridium brings recurring revenue/cash flow while Sep ATM completed transaction financing.",
      "source_type": "other",
      "source": "runs/RKLB/sources/IRIDIUM_2026_key_facts.txt",
      "period": "Sep 2026",
      "as_of_date": "2026-09-15",
      "value": "funded",
      "fact_or_estimate": "interpretation"
    }
  ],
  "counterevidence": [
    "Standalone OCF is still negative.",
    "Recent dilution is very large.",
    "Base DCF remains highly terminal-value dependent."
  ],
  "unknowns": [
    "Neutron commercial economics",
    "post-close integration",
    "share-count path"
  ],
  "falsifiers": [
    "If calibrated AS/SL/DI/FS fall below Moonshot thresholds or a hard veto is confirmed, reclassify."
  ],
  "hard_veto_flags": [],
  "key_kpis": [
    {
      "name": "owner FCF/share",
      "direction": "up",
      "threshold": "positive and rising after transaction close",
      "cadence": "quarterly"
    }
  ],
  "next_checks": [
    "Next quarter and Iridium close"
  ],
  "verdict": "support"
}
